{
  "sdk": 4,
  "id": "ice-pair-ranker",
  "name": "ICE pair ranker",
  "blurb": "Paste the candidate lines from both sides of a call and see what ICE will do with them: which pairs it forms, which it drops as duplicates, and the order it tries them in, with each step explained.",
  "version": "1.0.0",
  "capabilities": [
    "pure"
  ],
  "runtime": {
    "entry": "index.ts",
    "thread": "main"
  },
  "kinds": [
    "group",
    "fields",
    "heatmap",
    "table",
    "error"
  ],
  "card": "live",
  "cardFields": 4,
  "inputs": [
    {
      "id": "local",
      "type": "textarea",
      "label": "Local candidates",
      "description": "One a=candidate line each, from your SDP or from webrtc-internals.",
      "primary": true,
      "dir": "ltr",
      "rows": 4,
      "maxLength": 8192,
      "default": "a=candidate:1 1 udp 2130706431 192.168.1.42 50004 typ host\na=candidate:2 1 udp 1694498815 192.0.2.10 54321 typ srflx raddr 192.168.1.42 rport 50004\na=candidate:3 1 udp 16777215 198.51.100.50 49152 typ relay raddr 192.0.2.10 rport 54321"
    },
    {
      "id": "remote",
      "type": "textarea",
      "label": "Remote candidates",
      "description": "The other side's, the same way.",
      "primary": true,
      "dir": "ltr",
      "rows": 3,
      "maxLength": 8192,
      "default": "a=candidate:1 1 udp 2130706431 198.51.100.20 50004 typ host"
    },
    {
      "id": "controlling",
      "type": "select",
      "label": "Controlling side",
      "description": "The agent that nominates the pair. Its candidates are G in the pair formula, the other side's D.",
      "default": "local",
      "options": [
        {
          "value": "local",
          "label": "Local"
        },
        {
          "value": "remote",
          "label": "Remote"
        }
      ]
    }
  ],
  "samples": [
    {
      "label": "Alice and an ICE-lite server",
      "input": {
        "local": "a=candidate:1 1 udp 2130706431 192.168.1.42 50004 typ host\na=candidate:2 1 udp 1694498815 192.0.2.10 54321 typ srflx raddr 192.168.1.42 rport 50004\na=candidate:3 1 udp 16777215 198.51.100.50 49152 typ relay raddr 192.0.2.10 rport 54321",
        "remote": "a=candidate:1 1 udp 2130706431 198.51.100.20 50004 typ host",
        "controlling": "local"
      }
    },
    {
      "label": "Two browsers",
      "input": {
        "local": "a=candidate:1 1 udp 2130706431 192.168.1.42 50004 typ host\na=candidate:2 1 udp 1694498815 192.0.2.10 54321 typ srflx raddr 192.168.1.42 rport 50004\na=candidate:3 1 udp 16777215 198.51.100.50 49152 typ relay raddr 192.0.2.10 rport 54321",
        "remote": "a=candidate:1 1 udp 2130706431 10.0.0.8 61000 typ host\na=candidate:2 1 udp 1694498815 198.51.100.77 40100 typ srflx raddr 10.0.0.8 rport 61000\na=candidate:3 1 udp 16777215 198.51.100.51 49200 typ relay raddr 198.51.100.77 rport 40100",
        "controlling": "local"
      }
    },
    {
      "label": "Same call, the other side controls",
      "input": {
        "local": "a=candidate:1 1 udp 2130706431 192.168.1.42 50004 typ host\na=candidate:2 1 udp 1694498815 192.0.2.10 54321 typ srflx raddr 192.168.1.42 rport 50004\na=candidate:3 1 udp 16777215 198.51.100.50 49152 typ relay raddr 192.0.2.10 rport 54321",
        "remote": "a=candidate:1 1 udp 2130706431 10.0.0.8 61000 typ host\na=candidate:2 1 udp 1694498815 198.51.100.77 40100 typ srflx raddr 10.0.0.8 rport 61000\na=candidate:3 1 udp 16777215 198.51.100.51 49200 typ relay raddr 198.51.100.77 rport 40100",
        "controlling": "remote"
      }
    },
    {
      "label": "mDNS and IPv6",
      "input": {
        "local": "a=candidate:1 1 udp 2122260223 7f3c1b2e-4d5a-4b6c-8d7e-9f0a1b2c3d4e.local 50004 typ host\na=candidate:2 1 udp 2122262783 2001:db8::42 50006 typ host\na=candidate:3 1 udp 1686052607 192.0.2.10 54321 typ srflx raddr 0.0.0.0 rport 0",
        "remote": "a=candidate:1 1 udp 2130706431 198.51.100.20 50004 typ host",
        "controlling": "local"
      }
    }
  ],
  "help": "README.md",
  "tags": [
    "ice",
    "webrtc",
    "networking",
    "nat"
  ],
  "links": [
    {
      "label": "RFC 8445 section 6.1.2: forming the checklist",
      "href": "https://www.rfc-editor.org/rfc/rfc8445#section-6.1.2"
    },
    {
      "label": "RFC 8839 section 5.1: the candidate attribute",
      "href": "https://www.rfc-editor.org/rfc/rfc8839#section-5.1"
    }
  ]
}
