{
	"sdk": 6,
	"id": "metric-cardinality",
	"name": "Metric cardinality calculator",
	"blurb": "List a metric's labels and how many values each takes, pick where it is stored, and see how many time series it really writes, which change saves the most, and what that backend bills it in.",
	"version": "3.1.0",
	"capabilities": ["pure"],
	"runtime": {
		"entry": "index.ts",
		"thread": "main"
	},
	"kinds": ["group", "fields", "text", "series", "table", "error"],
	"card": "live",
	"cardFields": 4,
	"inputs": [
		{
			"id": "labels",
			"type": "textarea",
			"label": "Labels and their values",
			"description": "One label per line, or dimension for CloudWatch and Azure: its name and how many different values it takes, such as \"route 8\". Leave it empty for a metric with no labels.",
			"primary": true,
			"default": "route 8\nstatus 5",
			"rows": 4,
			"maxLength": 2000,
			"dir": "ltr"
		},
		{
			"id": "backend",
			"type": "select",
			"label": "Where the metric is stored",
			"description": "Decides what one label set writes, whether each target gets its own series, the limits that apply, and the unit it is billed in.",
			"primary": true,
			"default": "prometheus",
			"options": [
				{
					"value": "prometheus",
					"label": "Prometheus, self-hosted"
				},
				{
					"value": "amp",
					"label": "Amazon Managed Service for Prometheus"
				},
				{
					"value": "azure-prom",
					"label": "Azure Monitor managed service for Prometheus"
				},
				{
					"value": "gmp",
					"label": "Google Cloud Managed Service for Prometheus"
				},
				{
					"value": "cloudwatch",
					"label": "Amazon CloudWatch custom metrics, including EMF"
				},
				{
					"value": "azure-custom",
					"label": "Azure Monitor custom metrics (not Prometheus)"
				},
				{
					"value": "gcm-custom",
					"label": "Google Cloud Monitoring custom metrics"
				}
			]
		},
		{
			"id": "type",
			"type": "select",
			"label": "Metric type",
			"description": "What one label set writes. On Prometheus a classic histogram is one series per bucket, plus _sum and _count; CloudWatch and Azure custom metrics store one series whatever the type.",
			"primary": true,
			"default": "histogram",
			"options": [
				{
					"value": "histogram",
					"label": "Histogram (classic buckets)"
				},
				{
					"value": "counter",
					"label": "Counter"
				},
				{
					"value": "gauge",
					"label": "Gauge"
				},
				{
					"value": "summary",
					"label": "Summary, no quantiles (Python's only kind)"
				},
				{
					"value": "summary3",
					"label": "Summary, 3 quantiles (0.5, 0.9, 0.99)"
				},
				{
					"value": "native",
					"label": "Native histogram"
				}
			]
		},
		{
			"id": "client",
			"type": "select",
			"label": "Client library",
			"primary": true,
			"description": "Fills in the bucket count and _created with that library's defaults, which you can then change.",
			"default": "python",
			"options": [
				{
					"value": "python",
					"label": "Python prometheus_client",
					"sets": {
						"buckets": 14,
						"created": true
					}
				},
				{
					"value": "python-nocreated",
					"label": "Python, with PROMETHEUS_DISABLE_CREATED_SERIES",
					"sets": {
						"buckets": 14,
						"created": false
					}
				},
				{
					"value": "go",
					"label": "Go client_golang",
					"sets": {
						"buckets": 11,
						"created": false
					}
				},
				{
					"value": "custom",
					"label": "Custom"
				}
			]
		},
		{
			"id": "targets",
			"type": "number",
			"label": "Targets",
			"description": "Processes writing the metric: pods, instances. On Prometheus each is scraped with its own instance label, and on Cloud Monitoring each writes to its own monitored resource, so each multiplies the count. On CloudWatch and Azure custom metrics they share a series unless a label tells them apart.",
			"primary": true,
			"default": 1,
			"min": 1,
			"max": 100000,
			"step": 1
		},
		{
			"id": "occur",
			"type": "number",
			"label": "Combinations that occur",
			"unit": "%",
			"description": "The product of the counts is the ceiling. If only some combinations ever happen (most routes never return most statuses), say what share.",
			"default": 100,
			"min": 0.01,
			"max": 100,
			"step": 1
		},
		{
			"id": "buckets",
			"type": "number",
			"label": "Histogram buckets",
			"description": "Bucket boundaries, not counting +Inf. Only a classic histogram reads it.",
			"default": 14,
			"min": 0,
			"max": 1000,
			"step": 1
		},
		{
			"id": "created",
			"type": "toggle",
			"label": "Writes _created",
			"description": "One more series per label set for counters, histograms and summaries, on the Prometheus backends. Newer Prometheus servers can store it as metadata instead; turn it off if yours does.",
			"default": true
		},
		{
			"id": "interval",
			"type": "number",
			"label": "Scrape or write interval",
			"unit": "s",
			"description": "How often each series gets a point. Prometheus's own default is 60 s; 15 s is common. Google takes at most one point every 5 s, and Azure custom metrics are ingested once a minute whatever you send.",
			"default": 15,
			"min": 1,
			"max": 3600,
			"step": 1
		},
		{
			"id": "price",
			"type": "number",
			"label": "Your price per billing unit",
			"unit": "$",
			"description": "What your backend charges for the unit the answer names: 1,000 active series a month for self-hosted or a vendor that bills series, 10 million samples on Amazon's or Azure's managed Prometheus, 1 million on Google's, a metric-month on CloudWatch, a MiB on Cloud Monitoring. 0 leaves the bill out.",
			"default": 0,
			"min": 0,
			"max": 100000,
			"step": 0.5
		}
	],
	"samples": [
		{
			"label": "One label set, Python",
			"input": {
				"backend": "prometheus",
				"labels": "route 1\nstatus 1",
				"type": "histogram",
				"client": "python",
				"buckets": 14,
				"created": true,
				"targets": 1,
				"occur": 100
			}
		},
		{
			"label": "Add a tenant label",
			"input": {
				"backend": "prometheus",
				"labels": "route 1\nstatus 1\ntenant 500",
				"type": "histogram",
				"client": "python",
				"buckets": 14,
				"created": true,
				"targets": 1,
				"occur": 100
			}
		},
		{
			"label": "A Go service on 20 pods",
			"input": {
				"backend": "prometheus",
				"labels": "route 12\nmethod 3\nstatus 6",
				"type": "histogram",
				"client": "go",
				"buckets": 11,
				"created": false,
				"targets": 20,
				"occur": 25
			}
		},
		{
			"label": "Same, on Amazon Managed Prometheus",
			"input": {
				"backend": "amp",
				"labels": "route 12\nmethod 3\nstatus 6",
				"type": "histogram",
				"client": "go",
				"buckets": 11,
				"created": false,
				"targets": 20,
				"occur": 25,
				"interval": 30
			}
		},
		{
			"label": "CloudWatch EMF with a customer dimension",
			"input": {
				"backend": "cloudwatch",
				"labels": "operation 6\nstatus 3\ncustomer 200",
				"type": "histogram",
				"client": "custom",
				"buckets": 11,
				"created": false,
				"targets": 12,
				"occur": 50,
				"interval": 60
			}
		},
		{
			"label": "Not a count",
			"input": {
				"backend": "prometheus",
				"labels": "route lots"
			}
		}
	],
	"help": "README.md",
	"tags": ["observability", "prometheus", "metrics", "cardinality", "cloudwatch", "azure-monitor", "cloud-monitoring"],
	"links": [
		{
			"label": "Prometheus: do not overuse labels",
			"href": "https://prometheus.io/docs/practices/instrumentation/#do-not-overuse-labels"
		},
		{
			"label": "Prometheus: metric and label naming",
			"href": "https://prometheus.io/docs/practices/naming/#labels"
		},
		{
			"label": "Prometheus: storage and capacity",
			"href": "https://prometheus.io/docs/prometheus/latest/storage/#operational-aspects"
		},
		{
			"label": "CloudWatch: dimensions",
			"href": "https://docs.aws.amazon.com/AmazonCloudWatch/latest/monitoring/cloudwatch_concepts.html#Dimension"
		},
		{
			"label": "Amazon Managed Service for Prometheus: quotas",
			"href": "https://docs.aws.amazon.com/prometheus/latest/userguide/AMP_quotas.html"
		},
		{
			"label": "Azure Monitor: service limits",
			"href": "https://learn.microsoft.com/en-us/azure/azure-monitor/fundamentals/service-limits"
		},
		{
			"label": "Cloud Monitoring: quotas and limits",
			"href": "https://cloud.google.com/monitoring/quotas"
		}
	],
	"autoRun": false
}
